{
  "$schema": "https://json-schema.org/draft/2020-12/schema",
  "$id": "https://threadmesh.dev/spec/0.0-draft/disposition.schema.json",
  "title": "ThreadMesh message disposition snapshot",
  "type": "object",
  "additionalProperties": false,
  "required": [
    "specVersion",
    "dispositionId",
    "messageId",
    "receiver",
    "revision",
    "delivery",
    "decision",
    "outcome",
    "updatedAt"
  ],
  "properties": {
    "specVersion": { "const": "0.0-draft" },
    "dispositionId": {
      "type": "string",
      "pattern": "^dsp_[A-Za-z0-9][A-Za-z0-9._:-]{6,196}$"
    },
    "messageId": {
      "type": "string",
      "pattern": "^msg_[A-Za-z0-9][A-Za-z0-9._:-]{6,196}$"
    },
    "receiver": {
      "$ref": "https://threadmesh.dev/spec/0.0-draft/types.schema.json#/$defs/taskRef"
    },
    "revision": { "type": "integer", "minimum": 0 },
    "delivery": {
      "type": "object",
      "additionalProperties": false,
      "required": ["state", "observedAt"],
      "properties": {
        "state": {
          "enum": [
            "control-plane-accepted",
            "durably-received",
            "receiver-notified",
            "checkpoint-offered",
            "context-admitted",
            "adapter-submitted",
            "failed",
            "expired"
          ]
        },
        "observedAt": { "type": "string", "format": "date-time" },
        "failureReason": {
          "type": "string",
          "minLength": 1,
          "maxLength": 2000
        }
      },
      "allOf": [
        {
          "if": {
            "properties": { "state": { "const": "failed" } },
            "required": ["state"]
          },
          "then": {
            "properties": { "failureReason": true },
            "required": ["failureReason"]
          }
        }
      ]
    },
    "decision": {
      "type": "object",
      "additionalProperties": false,
      "required": ["state"],
      "properties": {
        "state": {
          "enum": [
            "pending",
            "accepted",
            "rejected",
            "deferred",
            "stale",
            "expired",
            "unsupported",
            "revoked"
          ]
        },
        "decidedAt": { "type": "string", "format": "date-time" },
        "decidedBy": {
          "$ref": "https://threadmesh.dev/spec/0.0-draft/types.schema.json#/$defs/actorRef"
        },
        "reasonCode": {
          "$ref": "https://threadmesh.dev/spec/0.0-draft/types.schema.json#/$defs/reasonCode"
        },
        "detail": { "type": "string", "maxLength": 4000 }
      },
      "allOf": [
        {
          "if": {
            "properties": {
              "state": { "not": { "const": "pending" } }
            },
            "required": ["state"]
          },
          "then": {
            "properties": {
              "decidedAt": true,
              "decidedBy": true,
              "reasonCode": true
            },
            "required": ["decidedAt", "decidedBy", "reasonCode"]
          }
        },
        {
          "if": {
            "properties": { "state": { "const": "pending" } },
            "required": ["state"]
          },
          "then": {
            "properties": {
              "decidedAt": false,
              "decidedBy": false,
              "reasonCode": false,
              "detail": false
            }
          }
        },
        {
          "if": {
            "properties": { "state": { "const": "accepted" } },
            "required": ["state"]
          },
          "then": {
            "properties": { "reasonCode": { "const": "accepted" } }
          }
        },
        {
          "if": {
            "properties": { "state": { "const": "rejected" } },
            "required": ["state"]
          },
          "then": {
            "properties": {
              "reasonCode": {
                "enum": [
                  "policy-denied",
                  "receiver-rejected",
                  "structured-gate-required",
                  "backpressure",
                  "evidence-insufficient",
                  "other"
                ]
              }
            }
          }
        },
        {
          "if": {
            "properties": { "state": { "const": "deferred" } },
            "required": ["state"]
          },
          "then": {
            "properties": {
              "reasonCode": {
                "enum": ["receiver-deferred", "backpressure", "other"]
              }
            }
          }
        },
        {
          "if": {
            "properties": { "state": { "const": "stale" } },
            "required": ["state"]
          },
          "then": {
            "properties": {
              "reasonCode": {
                "enum": ["stale-incarnation", "stale-run", "stale-objective"]
              }
            }
          }
        },
        {
          "if": {
            "properties": { "state": { "const": "expired" } },
            "required": ["state"]
          },
          "then": {
            "properties": { "reasonCode": { "const": "expired" } }
          }
        },
        {
          "if": {
            "properties": { "state": { "const": "unsupported" } },
            "required": ["state"]
          },
          "then": {
            "properties": {
              "reasonCode": {
                "enum": [
                  "unsupported-intent",
                  "unsupported-delivery-mode",
                  "structured-gate-required"
                ]
              }
            }
          }
        },
        {
          "if": {
            "properties": { "state": { "const": "revoked" } },
            "required": ["state"]
          },
          "then": {
            "properties": { "reasonCode": { "const": "revoked" } }
          }
        }
      ]
    },
    "outcome": {
      "type": "object",
      "additionalProperties": false,
      "required": ["state"],
      "properties": {
        "state": {
          "enum": [
            "not-observed",
            "effect-observed",
            "externally-verified",
            "failed"
          ]
        },
        "observedAt": { "type": "string", "format": "date-time" },
        "evidenceRefs": {
          "type": "array",
          "minItems": 1,
          "maxItems": 32,
          "uniqueItems": true,
          "items": {
            "$ref": "https://threadmesh.dev/spec/0.0-draft/types.schema.json#/$defs/evidenceRef"
          }
        },
        "verificationAttestations": {
          "type": "array",
          "minItems": 1,
          "maxItems": 16,
          "items": {
            "allOf": [
              {
                "$ref": "https://threadmesh.dev/spec/0.0-draft/verification-attestation.schema.json"
              },
              {
                "properties": {
                  "trustPolicy": {
                    "properties": { "decision": { "const": "trusted" } },
                    "required": ["decision"]
                  }
                }
              }
            ]
          }
        },
        "detail": { "type": "string", "maxLength": 4000 }
      },
      "allOf": [
        {
          "if": {
            "properties": { "state": { "const": "externally-verified" } },
            "required": ["state"]
          },
          "then": {
            "properties": {
              "observedAt": true,
              "evidenceRefs": true,
              "verificationAttestations": true
            },
            "required": ["observedAt", "evidenceRefs", "verificationAttestations"]
          }
        },
        {
          "if": {
            "properties": {
              "state": { "enum": ["effect-observed", "failed"] }
            },
            "required": ["state"]
          },
          "then": {
            "properties": { "observedAt": true },
            "required": ["observedAt"]
          }
        }
      ]
    },
    "updatedAt": { "type": "string", "format": "date-time" }
  },
  "allOf": [
    {
      "if": {
        "properties": {
          "delivery": {
            "properties": {
              "state": { "enum": ["context-admitted", "adapter-submitted"] }
            },
            "required": ["state"]
          }
        },
        "required": ["delivery"]
      },
      "then": {
        "properties": {
          "decision": {
            "properties": { "state": { "enum": ["accepted", "revoked"] } },
            "required": ["state"]
          }
        }
      }
    },
    {
      "if": {
        "properties": {
          "outcome": {
            "properties": {
              "state": { "enum": ["effect-observed", "externally-verified"] }
            },
            "required": ["state"]
          }
        },
        "required": ["outcome"]
      },
      "then": {
        "properties": {
          "delivery": {
            "properties": { "state": { "const": "adapter-submitted" } },
            "required": ["state"]
          },
          "decision": {
            "properties": { "state": { "enum": ["accepted", "revoked"] } },
            "required": ["state"]
          }
        }
      }
    }
  ]
}
